Name,Title,Description,Type,Priority,Status,Creation_Date,Estimation_Date,Story_Point
"Mule APIkit"," Show Scaffolder errors ","When there is an error at the scaffolder of the odata.raml the error message is not being shown",Task,"To be reviewed",Done,"2018-07-02 19:10:37","2018-07-02 18:10:37",2
"Mule APIkit","OData 2.0 Studio testing","OData 2.0 Studio testing",Task,Major,Done,"2019-01-02 18:57:12","2019-01-02 18:57:12",3
"Mule APIkit","Add test for get inlinecount param","Add test for get inlinecount param ODATA-85",Task,Minor,Done,"2019-02-07 12:37:58","2019-02-07 12:37:58",1
"Mule APIkit","Odata 2.0 Runtime testing","Odata 2.0 Runtime testing",Task,Major,Done,"2019-01-02 18:57:52","2019-01-02 18:57:52",3
"Mule APIkit","Replace Parser V2 by Parser Wrapper","We need remove from mule-artifact.json in Apikit        And replace in Odata code V2 Parser by using Parser Wrapper",Task,"To be reviewed",Done,"2018-06-14 15:35:05","2018-06-14 14:35:05",5
"Mule APIkit","Spike: Need to restart studio after error on scaffolder","After a error on the scaffolder of the `odata.raml` you need to restart the studio to be able to run it again.   ",Task,"To be reviewed",Done,"2018-07-02 19:04:25","2018-07-02 18:04:25",1
"Mule APIkit","OData support to Juan","OData support to Juan",Task,Major,Done,"2018-06-21 14:32:40","2018-06-21 13:32:40",3
"Mule APIkit","Test OData 2.0.0 with APIkit M4-1.2.0","Test OData 1.2.0 with APIkit M4-1.2.0",Task,"To be reviewed",Done,"2018-11-21 19:04:33","2018-11-21 19:04:33",2
"Mule APIkit","Fix OData Extension Unit Tests","Fix OData Extension Unit Tests",Task,"To be reviewed",Done,"2018-07-24 13:40:07","2018-07-24 12:40:07",3
"Mule APIkit","review release notes for odata","review release notes for odata with [~<EMAIL>]",Task,"To be reviewed",Done,"2019-01-16 18:46:11","2019-01-16 18:46:11",1
"Mule APIkit","Release Tooling OData RC-1","Release Tooling OData RC-1",Task,"To be reviewed",Done,"2018-12-05 18:42:28","2018-12-05 18:42:28",1
"Mule APIkit","Spike: Tooling: Investigate why dependencies.zip is required.","[https://github.com/mulesoft/mule-tooling-odata/pull/2#pullrequestreview-136761429]     ",Task,"To be reviewed",Done,"2018-07-12 22:43:24","2018-07-12 21:43:24",2
"Mule APIkit","Map RAML parser types to AMF types","I found some significant differences in the way types are grouped at the RAML parser and the AMF and figured out how to solve it after talking with Hernan Najles ",Task,"To be reviewed",Done,"2018-06-28 21:32:49","2018-06-28 20:32:49",2
"Mule APIkit","Upgrade Odata core version","Need to update the odata core version to 1.0.0",Task,"To be reviewed",Done,"2019-01-18 13:47:54","2019-01-18 13:47:54",1
"Mule APIkit","Include inlineCount at example and documentation","Need to add example and documentation to the new functionality inlineCount ",Task,Minor,Done,"2019-01-28 13:42:38","2019-01-28 13:42:38",3
"Mule APIkit","Reorganize dependencies from module now that there are no more functional test cases","Reorganize dependencies from module now that there are no more functional test cases",Task,"To be reviewed",Done,"2019-07-22 18:26:57","2019-07-22 17:26:57",0
"Mule APIkit","Update to the latest AMF version ( 3.0.1 )","Update to the latest AMF version ( 3.0.1 )",Task,"To be reviewed",Done,"2018-11-21 19:05:25","2018-11-21 19:05:25",1
"Mule APIkit","Release OData Extension Studio Plugin 1.0.1","Release OData Extension Studio Plugin 1.0.1  (ODATA version 1.0.5)",Task,Major,Done,"2017-10-09 14:45:14","2017-10-09 13:45:14",2
"Mule APIkit","Create RCPTT tests for ODATA 2.0 with Studio 6","Create a mind map with ODATA functional flows.         Use RCPTT to test an ODATA file with and without MAVEN     ",Task,Major,Done,"2017-10-09 15:54:58","2017-10-09 14:54:58",5
"Mule APIkit","Release Odata Tooling for Studio 6","Release Odata Tooling for Studio 6, this task includes release notes writing",Task,Major,Done,"2018-08-06 15:04:56","2018-08-06 14:04:56",1
"Mule APIkit","Release notes for odata 2.0.1","Release notes for odata 2.0.1",Task,"To be reviewed",Done,"2019-01-22 14:39:48","2019-01-22 14:39:48",1
"Mule APIkit","Odata Tooling issues getting extension from maven repository ","I'm getting this error when getting the maven dependency from the tooling  ",Task,"To be reviewed",Done,"2018-07-05 14:39:19","2018-07-05 13:39:19",2
"Mule APIkit","Remove references to RAML parser","Once the issue with AMF Xerces dependencies is solved proceed to remove all references to the RAML wrapper",Task,"To be reviewed",Done,"2018-06-29 20:20:51","2018-06-29 19:20:51",2
"Mule APIkit","Add MTF tests to Odata","Need to add MTF tests to Odata",Task,Major,Done,"2019-02-25 13:16:58","2019-02-25 13:16:58",3
"Mule APIkit","Backport Issues Fixes to Odata Extension for Mule 3","Backport issues to mule 3   * ODATA-37 Show Scaffolder errors   * ODATA-36 Need to restart studio after error on scaffolder    * ODATA-11 Improve error message when OData Scaffolding fails because an entity has no key",Task,"To be reviewed",Done,"2018-07-16 14:09:43","2018-07-16 13:09:43",5
"Mule APIkit","Releas Odata Extension 1.0.7","Releas Odata Extension 1.0.7",Task,Major,Done,"2018-08-06 15:07:01","2018-08-06 14:07:01",1
"Mule APIkit","Spike: Create amplitud event after installing the extension","After talking with tooling team we found that they aren't currently tracking Install new software events, Alejandro found this link [https://wiki.eclipse.org/Equinox_p2_download_stats]  that should allow to invoke an url after downloading making this possible we should investigate it further.",Task,"To be reviewed",Done,"2018-07-17 19:36:56","2018-07-17 18:36:56",2
"Mule APIkit","Add tests on apikit-odata-service-test to release job on jenkins","Add tests on apikit-odata-service-test to release job on jenkins.",Task,"To be reviewed",Done,"2019-02-13 12:50:07","2019-02-13 12:50:07",2
"Mule APIkit","Release ODATA 2.0.4",--,Task,"To be reviewed",Done,"2019-10-23 21:47:46","2019-10-23 20:47:46",1
"Mule APIkit","Improve error message when OData Scaffolding fails because an entity has no key","If an entity is defined without a key, scaffolder fails throwing the following error: Error: Index: 0, Size: 0 when attempting to generate the OData API.    Improve this error message to be more meaningful",Task,Minor,Done,"2018-01-04 14:52:27","2018-01-04 14:52:27",1
"Mule APIkit","Investigate issue loading xerces class",,Task,"To be reviewed",Done,"2018-06-21 18:23:27","2018-06-21 17:23:27",5
"Mule APIkit","Release ODATA 1.0.6","Release ODATA 1.0.6",Task,Major,Done,"2017-12-22 20:43:43","2017-12-22 20:43:43",1
"Mule APIkit","Pass the runtime edition from tooling to Scaffolder","Update:   * Apikit: ScaffolderService interface to include the runtime edition    * Tooling: Pass the runtime edition   * Odata Extension: change the null value to the runtime edition",Task,"To be reviewed",Done,"2018-07-11 20:53:17","2018-07-11 19:53:17",2
"Mule APIkit","APIKit OData MTF migration Phase 1","*APIKIT ODATA MTF migration *    ",Task,"To be reviewed",Done,"2019-05-22 20:01:57","2019-05-22 19:01:57",13
"Mule APIkit","Implement getUri() for the IRaml interface","Implement getUri() for the IRaml interface so it can be used at the odata extension to retrive the raml",Task,"To be reviewed",Done,"2018-07-25 13:39:42","2018-07-25 12:39:42",2
"Mule APIkit","Remediate vulnerabilities detected by NexusIQ","Regarding Muleteer Dashboard, APIkit (as a whole) has 1 detected vulnerabilities. Review and remediate them",Task,Major,Done,"2018-08-29 19:25:49","2018-08-29 18:25:49",1
"Mule APIkit","Release OData 2.0.0 APIkit extension","Release OData 1.2.0 APIkit extension",Task,"To be reviewed",Done,"2018-11-21 19:09:00","2018-11-21 19:09:00",1
"Mule APIkit","Create ODATA Tooling pipelines","*Create ODATA Tooling pipelines*    Mimic the apikit for soap tooling plans on jenkins following the same deployment structures.    Acceptance criteria:  * Create plans on jenkins for 6.x and 7.x  * document release deploy and snapshots deploy",Task,"To be reviewed",Done,"2019-06-05 19:45:04","2019-06-05 18:45:04",8
"Mule APIkit","Create Release Notes for version 1.0.9","Create Release Notes for version 1.0.8",Task,"To be reviewed",Done,"2018-12-22 01:12:14","2018-12-22 01:12:14",1
"Mule APIkit","OData extension 2.0.0 documentation","OData extension 2.0.0 documentation    First, review the existent OData for Mule 3 documentation and rewrite the same for Mule 4    OData for Mule 3 doc: https://docs.mulesoft.com/apikit/v/3.x/creating-an-odata-api-with-apikit",Task,Major,Done,"2018-06-22 16:26:41","2018-06-22 15:26:41",3
"Mule APIkit","Java 11 support APIkit for ODATA","Java 11 support APIkit for ODATA",Story,"To be reviewed",Done,"2019-01-16 19:10:00","2019-01-16 19:10:00",3
"Mule APIkit","OData Studio plugin for Mule 3: generate Amplitude events ","h2. Studio-OData events for Amplitude    We're planning to log certain events of the OData Tooling in Studio so we can measure the adoption of the extension and the final user experience.     Following are the events we're planning to log:   # _OData plugin Installation_: when a user clicks on Help->Install New Software and installs the OData extension   # _Scaffolder_: when someone right clicks on the _OData.raml_ file and clicks _Generate Odata API from RAML types__  __    _     * _Errors from scaffolder:_ we want to detect how often the Scaffolder process is failing, and the reasons for that failure    _Re-Scaffolder_: when someone runs the scaffolder again and the api.raml already exists.",Story,Major,Done,"2018-06-27 21:53:48","2018-06-27 20:53:48",5
"Mule APIkit","Spike: how to load OData extension from APIkit","Investigate how to load OData extension from APIkit",Story,Major,Done,"2018-05-22 14:01:47","2018-05-22 13:01:47",4
"Mule APIkit","Resolve vulnerability CVE-2018-8039 on mule 4","* Resolve vulnerability CVE-2018-8039 on mule 4",Story,Major,Done,"2018-08-15 20:08:09","2018-08-15 19:08:09",1
"Mule APIkit","Spike: Support Odata for Mule 4","Spike: Support Odata for Mule 4         Create a spec     ",Story,Major,Done,"2018-01-29 14:00:32","2018-01-29 14:00:32",8
"Mule APIkit","Migrate Tooling from Studio 6 to Studio 7","To be able to scaffold a new app, a new menu option was added to Studio 6 by creating a plugin.    Migrate this plugin to be used in Studio 7",Story,Major,Done,"2018-05-28 14:15:28","2018-05-28 13:15:28",5
"Mule APIkit","Spec for OData extension for Mule 4","Create a spec for OData extension for Mule 4    and share it with:    * Connectors   * La Greca   * <USER>  * Matias Coaker",Story,Major,Done,"2018-06-05 18:26:39","2018-06-05 17:26:39",3
"Mule APIkit","Run Sonar in OData 2.0","- Odata run Sonar in Jenkins (contact Paca)--> coverage?  - Odata: fix smells ",Story,Major,Done,"2018-08-15 20:10:49","2018-08-15 19:10:49",5
"Mule APIkit","Implement metadata for entities","When hitting the path *_/odata.svc/$metadata_*, the OData Router should return the metadata of the defined entities.    This is an example of the metadata that should be returned:  ",Story,Major,Done,"2018-05-28 14:08:56","2018-05-28 13:08:56",5
"Mule APIkit","Implement OData APIkit Processor","Requests other than Service Document nor Metadata must be processed by APIkit Router. In those cases, OData Router must translate the request to one readable by APIKit, delegate the processing to APIKit Router and finally translate the response to the requested format",Story,Major,Done,"2018-05-28 14:12:21","2018-05-28 13:12:21",5
"Mule APIkit","Implement Service Root URI","The service root URI identifies the root of an OData service. The service document is required to be returned from the root of an OData service to provide clients with a simple mechanism to enumerate all of the collections of resources available for the data service.    For instance: http://services.odata.org/OData/OData.svc/    Similar to metadata (ODATA-18), expose the service document under the path _*/odata.svc*_",Story,Major,Done,"2018-05-28 14:37:24","2018-05-28 13:37:24",3
"Mule APIkit","Resolve vulnerability CVE-2018-8039 on mule 3","* Resolve vulnerability CVE-2018-8039 on mule 3",Story,Major,Done,"2018-08-15 20:07:35","2018-08-15 19:07:35",1
"Mule APIkit","Implement Scaffolder using AMF","The entities are defined in the odata.raml file. In order to scaffold OData based apps, the plugin must parse the odata.raml file and generate the root raml (api.raml) adding the corresponding resources for the entities.    Migrate this functionality to be used in Studio 7 and Mule 4.",Story,Major,Done,"2018-05-28 14:14:30","2018-05-28 13:14:30",5
"Mule APIkit","Support multiple Odata models","Currently OData extension only support one odata model per mule app","Enhancement Request","To be reviewed",Resolved,"2019-02-28 16:03:38","2019-02-28 16:03:38",5
"Mule APIkit","SE-5886 : OData API returns wrong collection href","Related to SE-5886",Bug,Major,Closed,"2017-08-31 14:27:56","2017-08-31 13:27:56",5
"Mule APIkit","SE-8810 OData APIKit deployment to CloudHub naming restrictions","SE-8810: OData APIKit deployment to CloudHub naming restrictions.  See related issue for details.",Bug,"To be reviewed",Closed,"2018-07-17 14:16:10","2018-07-17 13:16:10",2
"Mule APIkit","SE-7305: OData fails when gettting a key value with Int64 format","Please refer to SE-7305",Bug,Major,Closed,"2017-12-12 19:52:01","2017-12-12 19:52:01",3
"Mule APIkit","File RAML type not supported by the OData plugin","Please refer to SE-6694",Bug,Major,Closed,"2017-09-25 21:30:52","2017-09-25 20:30:52",5
"Mule APIkit","Invalid RAML in ODATA 2.0.1 with Studio 7.3.4","See related ticket",Bug,"To be reviewed",Resolved,"2019-05-22 19:24:25","2019-05-22 18:24:25",8
"Mule APIkit","Odata Tooling is not getting the dependencies neither adding them at studio 7.4.0","Odata Tooling is not getting the dependencies neither adding them at studio 7.4.0",Bug,"To be reviewed",Closed,"2018-11-29 14:01:44","2018-11-29 14:01:44",3
"Mule APIkit","Header Accept:'Application/xml' is causing a 500 error","When trying this request e.g:              It returns a 500 error with this message:     It should return the list in xml format, it works as expected when the accept header is '*/*'     ",Bug,"To be reviewed",Closed,"2019-02-07 12:31:42","2019-02-07 12:31:42",2
"Mule APIkit","APIkit for OData does not accept a number as Edm.String",SE-10566 ,Bug,"To be reviewed",Closed,"2019-01-16 13:47:10","2019-01-16 13:47:10",3
"Mule APIkit","SE-9048 Odata query options inlinecount / top / filter does not seem to be supported","SE-9048  Odata query options inlinecount / top / filter does not seem to be supported  ",Bug,"To be reviewed",Closed,"2018-08-24 01:29:18","2018-08-24 00:29:18",2
"Mule APIkit","SE-7364: Performance issue: OData is parsing the RAML definition on every request","Please refer to SE-7364",Bug,Major,Closed,"2017-12-18 19:53:49","2017-12-18 19:53:49",3
"Mule APIkit","Odata plugin does no recognize nullable types and strings with only numbers","Please refer to SE-6322",Bug,Major,Closed,"2017-09-07 20:20:37","2017-09-07 19:20:37",5
"Mule APIkit","Wrong response from APIKit OData extension","Please refer to SE-5635",Bug,Major,Closed,"2017-09-26 19:07:25","2017-09-26 18:07:25",5
"Mule APIkit","Unable to modify xml:base URL for OData service","Unable to modify xml:base URL for OData service",Bug,"To be reviewed",Resolved,"2019-09-10 17:04:07","2019-09-10 16:04:07",2
"Mule APIkit","Raml union type is not being supported","Raml union type is not being supported, eg: an odata.raml with this type defined              Throws the following error           ",Bug,"To be reviewed",Closed,"2019-02-11 12:51:43","2019-02-11 12:51:43",2
"Mule APIkit","Metadata URI is not correct","The port and the url at the metada uri are not correct  ",Bug,"To be reviewed",Closed,"2019-02-08 16:38:25","2019-02-08 16:38:25",1
"Mule APIkit","Expected application/atom+xml but getting application/xml when format is atom","Althought is no clear at the spec ( [https://www.odata.org/documentation/odata-version-2-0/operations/] ) examples shows that the returned content type are application/atom+xml and we are returning application/xml (by spec both mime types are basically identical [https://www.iana.org/assignments/media-types/application/atom+xml] )",Bug,"To be reviewed",Closed,"2019-02-09 17:49:21","2019-02-09 17:49:21",1
"Mule APIkit","There are no valid root RAML files when creating generating OData API from RAML",SE-10546,Bug,"To be reviewed",Resolved,"2019-04-24 19:35:58","2019-04-24 18:35:58",5
"Mule APIkit","Keys should be URL encoded","Keys should be URL encoded",Bug,"To be reviewed",Resolved,"2019-05-17 20:29:52","2019-05-17 19:29:52",2
"Mule APIkit","SE-9179: Issue performing PUT/POST requests containing XML payloads to an API having APIKit OData plugin.","SE-9179: Issue performing PUT/POST requests containing XML payloads to an API having APIKit OData plugin.  See related issue for details",Bug,"To be reviewed",Closed,"2018-08-27 20:23:33","2018-08-27 19:23:33",3
"Mule APIkit","SE-8054: Generate new project with RAML results in the incorrect mime-type being returned from endpoint","SE-8054 for details    To reproduce   Import the attached project (jar file)  Select the transform message for flow get:\change-log-level\(loggerName)\(newLevel):router-config  you will see the output seted to application/json and the raml is indicating it as text/plain:",Bug,Minor,Closed,"2018-04-05 18:31:22","2018-04-05 17:31:22",2
"Mule APIkit","Body doesn't get validated if the body is empty","*Body doesn't get validated if the body is empty*    I have the following RAML:        If I send a POST request with the `{}` as the body of the request, APIKIT refuses the request because doesn't match with the required body, but if I send an empty request, this is taken as a valid one and is routed to the flow making it fail.",Bug,"To be reviewed",Closed,"2018-03-29 00:52:18","2018-03-28 23:52:18",2
"Mule APIkit","SE-7378: ApiKit router won't work if http listener has BaseUriParameter",Check SE-7378,Bug,Major,Closed,"2018-03-28 20:28:25","2018-03-28 19:28:25",3
"Mule APIkit","SE-7648 APIKit Raml Validation is failing to invalidate a body with only blank node","refer to https://www.mulesoft.org/jira/browse/SE-7648",Bug,"To be reviewed",Closed,"2018-03-28 20:28:14","2018-03-28 19:28:14",3
"Mule APIkit","APIKit router fails when converting text/xml to application/xml","refer to https://www.mulesoft.org/jira/browse/SE-7577",Bug,"To be reviewed",Closed,"2018-03-28 20:27:30","2018-03-28 19:27:30",3
"Mule APIkit","SE-7112 API error when receiving Accept Request-header - '*'","refer to https://www.mulesoft.org/jira/browse/SE-7112",Bug,"To be reviewed",Closed,"2018-03-28 20:26:39","2018-03-28 19:26:39",3
"Mule APIkit","When Repetable Streams are disabled, MultiPart consumes the payload","When configuring an HTTP Listener with non-repeatable-stream, and making a MultiPart request, then the payload is consumed by apikit, and not available anymore for the API implementation.    A test that shows this can be seen in the following branch: https://github.com/mulesoft/apikit/tree/APIKIT-1226",Bug,Critical,Closed,"2018-03-27 21:55:26","2018-03-27 20:55:26",2
"Mule APIkit","ApiKit unable to parse and validate json against schema referenced using $ref in design time","Please refer to SE-7966",Bug,Major,Closed,"2018-03-26 14:34:54","2018-03-26 13:34:54",2
"Mule APIkit","SE-7960: java.lang.ClassCastException: org.mule.transport.NullPayload cannot be cast to java.util.Map","See the following issue to reproduce it: https://www.mulesoft.org/jira/browse/SE-7960    Full stacktrace  ",Bug,Major,Closed,"2018-03-22 20:04:34","2018-03-22 20:04:34",2
"Mule APIkit","Failure in RAML validation on runtime 3.9.0","refer to https://www.mulesoft.org/jira/browse/SE-7557",Bug,"To be reviewed",Closed,"2018-03-21 19:35:37","2018-03-21 19:35:37",3
"Mule APIkit","SE-7162: patch does not honour the encoding set","Please check SE-7162:",Bug,Major,Closed,"2018-03-05 13:09:36","2018-03-05 13:09:36",2
"Mule APIkit","date-only accepts values outside of RAML specification","refer to SE-7415",Bug,"To be reviewed",Closed,"2018-03-01 18:29:52","2018-03-01 18:29:52",1
"Mule APIkit","SE-7622: Wrong Date Only Validation","Description of the issue:  I have the following RAML spec,    #%RAML 1.0   title: test-date-spec   version: v1   baseUri: http://localhost:8081     /testuri:   get:   queryParameters:   startDate:   required: true   displayName: startDate   description: The starting departure date from which to search flights in yyyy-MM-dd date format, e.g. 2017-10-23.   type: date-only   responses:   200:   body:   application/json:   It seems that type: date-only is not working properly: 2018-01-32 is not a valid date    Steps to replicate:    Import and run the project    send the following request,    curl -X GET \   'http://127.0.0.1:8081/api/testuri?startDate=2018-21-32'    You get a valid 400 Bad Request response which is understandable as 2018-21-32 is not a valid date.    But if you do the following,    curl -X GET \   'http://127.0.0.1:8081/api/testuri?startDate=2018-01-32'    This gives me a 200 OK even though 2018-01-32 is not a valid date.",Bug,Major,Closed,"2018-02-20 19:59:34","2018-02-20 19:59:34",2
"Mule APIkit","SE-6777: API Kit Console not handling RAML includes with spaces in filename","Please refer to SE-6777",Bug,Major,Closed,"2018-02-09 02:15:37","2018-02-09 02:15:37",2
"Mule APIkit","SE-7218: Try it fails when a query parameter is empty","Please refer to SE-7218",Bug,Major,Closed,"2018-02-09 02:14:23","2018-02-09 02:14:23",5
"Mule APIkit","SE-7416: Cannot define custom transaction ID when APIKit based project results in error","Cannot define custom transaction ID when APIKit based project results in error    SE-7416",Bug,Major,Closed,"2018-02-09 02:06:45","2018-02-09 02:06:45",5
"Mule APIkit","SE-7187: Issue with APIKit console and array query param","Please refer to SE-7187",Bug,Major,Closed,"2018-02-09 02:04:56","2018-02-09 02:04:56",5
"Mule APIkit","Scaffolder duplicates flows if there are in a different xml where the api router lives","Steps to reproduce:    # Create an app.xml mule configuration file  # Create a basic RAML file.  # Run APIKIT scaffolder to generate flows based on the RAML  # Create another mule configuration file called app2.xml  # Move the flow generated in app.xml to app2.xml  # Add a new endpoint or resource in the RAML file  # Run APIKIT scaffolder again     Expected behaviour:    Only the new flow should be generated.         Actual behaviour:    Both the new and the flow you moved in step 5 are generated, causing an error of having two flows with the same name.","Enhancement Request",Critical,Closed,"2018-02-08 20:12:10","2018-02-08 20:12:10",5
"Mule APIkit","SE-7577- APIKit router fails when converting text/xml to application/xml","See SE-7577",Bug,Minor,Closed,"2018-01-25 18:41:54","2018-01-25 18:41:54",3
"Mule APIkit","SE-7575: APIKit changed behavior for HTTP payloads","Please refer to SE-7575",Bug,Critical,Closed,"2018-01-25 12:59:45","2018-01-25 12:59:45",3
"Mule APIkit","Performance testing : knowledge transfer of Jmeter and Jprofiler","Performance testing : knowledge transfer to Nicolas of Jmeter and Jprofiler",Bug,Major,Closed,"2018-01-15 13:46:54","2018-01-15 13:46:54",1
"Mule APIkit","SE-7407: Error in a request with query parameter defined as a string array with only one element","Please refer to SE-7407",Bug,Major,Closed,"2017-12-27 12:52:15","2017-12-27 12:52:15",3
"Mule APIkit","SE-7194: java.lang.NoClassDefFoundError: org/mule/tooling/apikit ...","Please refer to SE-7194",Bug,Major,Closed,"2017-12-13 20:05:26","2017-12-13 20:05:26",3
"Mule APIkit","STUDIO-10264: API Console does not work with XML schema","Please refer to STUDIO-10264",Bug,Critical,Closed,"2017-12-12 19:31:19","2017-12-12 19:31:19",3
"Mule APIkit","SE-7307: unable to generate flows from RAML using schemas","Please refer to SE-7307",Bug,Critical,Closed,"2017-12-12 18:10:37","2017-12-12 18:10:37",3
"Mule APIkit","Implement a custom ResourceLoader to manage Exchange Modules","Due to the way Exchange works, modules imported from that repository always are located in the root of the RAML Project.    Implement and provide to APIKit with a new ResourceLoader to manage them    More info in SE-7126",Bug,"To be reviewed",Closed,"2017-11-21 13:13:57","2017-11-21 13:13:57",3
"Mule APIkit","SE-7143: APIKit console is unable to find schemas !included in RAML (0.8)","Please refer to SE-7143",Bug,Major,Closed,"2017-11-17 12:27:20","2017-11-17 12:27:20",3
"Mule APIkit","SE-7162: APIKit overrides incorrectly the default transformation graph","Please refer to SE-7162",Bug,Blocker,Closed,"2017-11-13 18:02:11","2017-11-13 18:02:11",2
"Mule APIkit","Apikit config does not resolve RAMLs defined as a URL","Given the following Apikit Config, containing a RAML file URL:    +Actual result:+      It does not generate flows when scaffolding:        The module cannot resolve this either. This causes that the request cannot be validated against the RAML file.    +Expected result:+  Apikit should accept and resolve RAML files from external sources and not rely only in the filesystem.  ","Enhancement Request",Major,Closed,"2017-11-10 16:46:11","2017-11-10 16:46:11",2
