Name,Title,Description,Type,Priority,Status,Creation_Date,Estimation_Date,Story_Point
"Mule APIkit","Exception thrown when trying to scaffold in studio 7.1","The following error is thrown when trying to scaffols in studio 7         An internal error has occurred.    loader constraint violation: when resolving interface method org.apache.maven.model.building.ModelBuildingRequest.setModelResolver(Lorg/apache/maven/model/resolution/ModelResolver;)Lorg/apache/maven/model/building/ModelBuildingRequest; the class loader (instance of org/eclipse/osgi/internal/loader/EquinoxClassLoader) of the current class, org/apache/maven/repository/internal/DefaultArtifactDescriptorReader, and the class loader (instance of org/eclipse/osgi/internal/loader/EquinoxClassLoader) for the method's defining class, org/apache/maven/model/building/ModelBuildingRequest, have different Class objects for the type org/apache/maven/model/resolution/ModelResolver used in the signature",Bug,"To be reviewed",Open,"2018-01-10 20:27:31","2018-01-10 20:27:31",1
"Mule APIkit","SE-9091 Studio 7.2.1: XSD and WSLD files are not being imported when creating a Mule project using WSDL","SE-9091  Studio 7.2.1: XSD and WSLD files are not being imported when creating a Mule project using WSDL",Bug,"To be reviewed",Closed,"2018-08-14 16:23:27","2018-08-14 15:23:27",3
"Mule APIkit","APIkit for SOAP Config: Error creating a Config from scratch",,Bug,Critical,Closed,"2018-01-29 18:36:31","2018-01-29 18:36:31",2
"Mule APIkit","APIKit for SOAP does not preserves CDATA tags on SOAP","If you send a Body like this:        The node <caseId>  is tranformed into    ",Bug,"To be reviewed",Closed,"2018-10-09 16:01:29","2018-10-09 15:01:29",2
"Mule APIkit","Bump WSDL parser version in the metatada module","*Bump WSDL parser version in the metatada module*    take advantage of the latests metadata fixes by using the latest wsdl parser version",Bug,"To be reviewed",Resolved,"2019-06-13 18:35:46","2019-06-13 17:35:46",5
"Mule APIkit","SE-6113-  Scaffolder now validates that the operations in WSDL have a valid input/output","Please refer to SE-6113    The bug is in lines 72 and 73 of the WSDL, instead of :    it should be :  ",Bug,Minor,Closed,"2017-09-26 14:12:31","2017-09-26 13:12:31",5
"Mule APIkit","Support SoapFault message inside CDATA","In SoapKit for Mule 3.x this was resolved using a User Custom Interceptor. We need manage custom Interceptors using cxf.xml or add a new property in SoapKit config to manage it.",Bug,Major,Triaged,"2018-04-12 19:44:40","2018-04-12 18:44:40",5
"Mule APIkit","SE-8318: APIKIT For SOAP is not routing to the correct flow when no soapAction defined","SE-8318: APIKIT For SOAP is not routing to the correct flow when no soapAction defined     Se related issue for details",Bug,Major,Closed,"2018-05-22 20:30:29","2018-05-22 19:30:29",5
"Mule APIkit","Show pop-up to select port when generating flows from WSDL from project level","Currently the Soapkit tooling allows to generate flows at project level, but it doesn't shows the pop-up to select the port",Bug,"To be reviewed",Closed,"2018-08-13 14:53:25","2018-08-13 13:53:25",3
"Mule APIkit","inboundValidationEnable is not validating SOAP messages","inboundValidationEnable is not validating SOAP messages",Bug,Major,Closed,"2018-01-29 15:52:52","2018-01-29 15:52:52",8
"Mule APIkit","WSDL & XSD files are not returned in SOAP Server Proxy","SOAP Server Proxy server is responsible fro returning WSDL and XSD resurces when URL is like: http://<SERVER>/api/?wsdl",Bug,"To be reviewed",Closed,"2017-11-01 15:41:25","2017-11-01 15:41:25",5
"Mule APIkit","DOCTYPE is not allowed despite enabling expandExternalEntities","DOCTYPE is not allowed despite enabling expandExternalEntities",Bug,"To be reviewed",Closed,"2019-09-04 20:36:44","2019-09-04 19:36:44",0
"Mule APIkit","upgrade CXF Woodstock version due to vulnerabilities","*upgrade CXF Woodstock version due to vulnerabilities*    Currently using 2.7.x, this was moved to cxf core 3.2.x.",Bug,"To be reviewed",Resolved,"2019-07-12 19:21:45","2019-07-12 18:21:45",5
"Mule APIkit","SE-6120: Duplicate scaffolding when re-generating project from SOAPKit","Related to SE-6120  Timeframe: July-2017",Bug,Major,Closed,"2017-06-20 02:48:41","2017-06-20 01:48:41",3
"Mule APIkit","OOM with big payload","There is an out of memory when the payload is big enough. The problem seems to be [here|https://github.com/mulesoft/apikit-soap-cxf/blob/ecdbe73fe41a3f0f6bec5a77eee992cb20632a63/src/main/java/org/mule/soapkit/soap/server/interceptor/OutputPayloadInterceptor.java#L53]    To reproduce create and application with a soap router and a flow that reads from a big file     ",Bug,"To be reviewed",Resolved,"2019-09-03 23:17:57","2019-09-03 22:17:57",3
"Mule APIkit","Create a build plan for the SK plugin","A build plan must be created for the soapkit plugin where an daily updateSite is generated and deployed, available for anyone to download.",Bug,Critical,Closed,"2015-11-16 16:18:17","2015-11-16 16:18:17",2
"Mule APIkit","APIKit SOAP fails with Validation enabled when performing a GET request","*APIKit SOAP fails with Validation enabled when performing a GET request*    Throws a null pointer exception.    Create a APIKit for SOAP App and enable validations, then perform a get request to any operation      ",Bug,"To be reviewed",Open,"2019-08-02 21:10:09","2019-08-02 20:10:09",3
"Mule APIkit","SOAPKit Extension module maven name is invalid","The Extension maven artifact should be called:    org.mule.modules:mule-soapkit-module    despite that this name is included in privileged mule API we are facing privilege problems.   You can check that soapkit is privileged taking a look at META-INF/mule-module.properties in mule-extensions-api jar, e.g.        ",Bug,Major,Closed,"2017-11-01 18:41:07","2017-11-01 18:41:07",3
"Mule APIkit","SE-9408 SOAP API Kit is discarding the attributes and variables","SE-9408  SOAP API Kit is discarding the attributes and variables    See related issue for details",Bug,"To be reviewed",Closed,"2018-09-19 14:40:11","2018-09-19 13:40:11",3
"Mule APIkit","Wrong generation of set-payload content when scaffolding","Nowadays, we are generating the set-payload content this way:      Change it in order to use dataweave instead  ",Bug,Critical,Closed,"2018-01-17 16:33:11","2018-01-17 16:33:11",1
"Mule APIkit","Stream is closed","Stream is closed",Bug,"To be reviewed",Resolved,"2019-06-19 20:58:33","2019-06-19 19:58:33",8
"Mule APIkit","unable to propagate errorDescription using SOAP apikit","unable to propagate errorDescription using SOAP apikit",Bug,"To be reviewed",Resolved,"2019-07-03 19:40:01","2019-07-03 18:40:01",5
"Mule APIkit","Support Escalations SE-6157: When setting inboundValidationMessage true in soapkit it result in error cannot be cast to org.codehaus.stax2.XMLStreamReader2","Related to SE-6157",Bug,"To be reviewed",Closed,"2017-06-26 16:24:50","2017-06-26 15:24:50",10
"Mule APIkit","Schema Validation (inboundValidationMessage=true) returns the tagnames enclosed by <> in a SOAP:fault ","SE-11141  Schema Validation (inboundValidationMessage=true) returns the tagnames enclosed by <> in a SOAP:fault   ",Bug,"To be reviewed",Resolved,"2019-03-08 12:52:27","2019-03-08 12:52:27",2
"Mule APIkit","WSDL retrieved from SOAPkit via HTTPS has HTTP soap:address only on CloudHub","APIkit for SOAP (SOAPkit) is used to expose a SOAP webservice behind an HTTPS listener:            with the WSDL containing the conventional placeholder for `soap:address`:        At runtime, SOAPkit replaces that address with the actual endpoint URL.    This works fine on localhost:        But when the same app is deployed to CloudHub, the address which SOAPkit inserts uses HTTP instead of HTTPS:        Because that webservice listens only on HTTPS and not on HTTP, HTTP requests to that endpoint URL will fail.    Our workaround now is to expose the webservice not only over HTTPS but also over HTTP. However, this is not a solution for security-conscious organisations.",Bug,"To be reviewed",Resolved,"2019-01-25 10:56:21","2019-01-25 10:56:21",3
"Mule APIkit","SOAPKIT deployment fails randomly","Soapkit deployment fails randomly with the following exception:     ",Bug,Critical,Closed,"2018-01-17 19:36:59","2018-01-17 19:36:59",1
"Mule APIkit","SE-10636 SOAP API Kit is sending 200 Status Code for Schema Validation Fault ","SE-10636  SOAP API Kit is sending 200 Status Code for Schema Validation Fault   ",Bug,"To be reviewed",Closed,"2019-01-25 01:28:14","2019-01-25 01:28:14",1
"Mule APIkit","For backward compatibility http status should be protocol header","For backward compatibility http status should be protocol header",Bug,"To be reviewed",Closed,"2019-03-28 20:50:47","2019-03-28 20:50:47",2
"Mule APIkit","SK plugin must Instrospect the selected WSDL and copy all imports and includes.","SK plugin must Instrospect the selected WSDL and copy all imports and includes.    Currently we have the *from folder* option as a workaround for .wsdl with imports and includes. We should be able to find all those included files whether they are o not in same folder, and not copy unnecesary files. ",Bug,Critical,Closed,"2015-11-16 16:15:19","2015-11-16 16:15:19",5
"Mule APIkit","SE-8048: APIKIT for SOAP (M3) is displaying incorrect namespace when a fault is returned","See SE-8084 for details",Bug,"To be reviewed",Closed,"2018-04-05 14:28:37","2018-04-05 13:28:37",5
"Mule APIkit","SE-9035: Soap Router Kit doesn't route correctly when multiple port types are present in a WSDL","SE-9035: Soap Router Kit doesn't route correctly when multiple port types are present in a WSDL  See related issue for details",Bug,"To be reviewed",Closed,"2018-08-08 02:08:44","2018-08-08 01:08:44",3
"Mule APIkit","SOAP Kit modifies soap:address location and it's not possible to use URI + ?wsdl to download it","Details at SE-10918",Bug,"To be reviewed",Closed,"2019-05-08 19:29:48","2019-05-08 18:29:48",3
"Mule APIkit","3.- Metadata Keys in Windows do not work, the Service and Port combo boxes are never populated with the values - In OSX works","3.- Metadata Keys in Windows do not work, the Service and Port combo boxes are never populated with the values ",Bug,Major,Closed,"2018-01-30 17:37:48","2018-01-30 17:37:48",2
"Mule APIkit","Backport: APIKIT For SOAP is not routing to the correct flow when no soapAction defined","APIKIT For SOAP is not routing to the correct flow when no soapAction defined",Bug,"To be reviewed",Closed,"2018-07-02 19:16:35","2018-07-02 18:16:35",1
"Mule APIkit","SE-9624 publishedEndpointUrl can not be configured when using Apikit:soap router ","SE-9624  publishedEndpointUrl can not be configured when using Apikit:soap router   ",Bug,"To be reviewed",Closed,"2018-10-09 16:59:09","2018-10-09 15:59:09",3
"Mule APIkit","SE-9301 soap action with blank string causing issue on the SOAP KIT router","SE-9301  soap action with blank string causing issue on the SOAP KIT router  See related issue for details",Bug,"To be reviewed",Closed,"2018-09-07 16:50:07","2018-09-07 15:50:07",3
"Mule APIkit","SE-10837 Unbound namespace prefix error introduced in SOAPKit","SE-10837 Unbound namespace prefix error introduced in SOAPKit  See related issue for details",Bug,"To be reviewed",Resolved,"2019-02-06 14:01:34","2019-02-06 14:01:34",5
"Mule APIkit","when using SOAP 1.2 soapaction should not be taken from the HTTP headers but the content-type","*when using SOAP 1.2 soapaction should not be taken from the HTTP headers but the content-type*    in SOAP 1.1 the action must be taken from the SOAPAction http header, but in SOAP 1.2 the action comes in the content-type.     e.g. application/soap+xml; soapaction=operation;    Currently apikit for soap is taking always de action from the header and not taking into account the content-type when its using SOAP 1.2.    This could break backwards compatibility so a property to enable this feature should be provided.  ",Bug,"To be reviewed",Open,"2019-07-05 21:43:53","2019-07-05 20:43:53",8
"Mule APIkit","DataSense for the headers seems to be wrong"," DataSense for the headers seems to be wrong, for the same sample `tshirt2.wsdl`, it suggest me childs that do not exists, failing the evaluation later on.   Through DS I can create the following script (wrong):    (notice the extra `header` under `headers`)  Instead of the followign (correct)    c.1) Besides the DS issue, the FAULT is somehow confussing,   I get    when it the routing was OK, is more like an `Internal issue while processing your request for the operation <XYZ>` or `Internal issue on Soap Server` if we don’t want to show anything internal to the app.",Bug,Major,Closed,"2018-05-10 21:56:48","2018-05-10 20:56:48",3
"Mule APIkit","SOAPKIT - Payload set in on error propagate for a SOAP Fault isn't returned to caller","SOAPKIT - Payload set in on error propagate for a SOAP Fault isn't returned to caller",Bug,"To be reviewed",Resolved,"2019-05-08 19:54:46","2019-05-08 18:54:46",8
"Mule APIkit","jackson-core is vulnerable to Denial of Service (DoS).","{{jackson-core}} is vulnerable to Denial of Service (DoS). The {{_reportInvalidToken()}} function in the {{UTF8StreamJsonParser}} and {{ReaderBasedJsonParser}} classes allows large amounts of extraneous data to be printed to the server log. An attacker can exploit this vulnerability by crafting a POST request containing large amounts of data. When the data contains invalid JSON, an exception is thrown, which results in the consumption of available disk space when the error message is written to {{server.log}} along with the request data.  Detection  The application is vulnerable by using this component.  Recommendation  We recommend upgrading to a version of this component that is not vulnerable to this specific issue.  Categories  Data  Root Cause  ehcache-2.10.4.jar *<=* UTF8StreamJsonParser.class_terracotta : [2.0.0-RC1, 2.8.6)  ehcache-2.10.4.jar *<=* ReaderBasedJsonParser.class_terracotta : [2.0.0-RC1, 2.8.6)  Advisories  Project: [https://github.com/FasterXML/jackson-core/pull/322]  Attack: [https://issues.jboss.org/browse/JBEAP-6316]     ",Bug,Major,Closed,"2018-01-18 11:44:03","2018-01-18 11:44:03",2
"Mule APIkit","SOAPRouter is not trowing any error and it does not go in to error handling block.","SOAPRouter is not trowing any error and it does not go in to error handling block.",Bug,"To be reviewed",Resolved,"2019-05-08 21:06:27","2019-05-08 20:06:27",8
"Mule APIkit","SE-7813: Exception strategy skipped by SOAPKit router","https://www.mulesoft.org/jira/browse/SE-7813    To reproduce:  # Deploy attached project on Studio 6.4.3  # with soapUI perform a request to http://localhost:8087/GlobalWeather/GlobalWeatherSoap/ with the following invalid request      After performing this steps, the following Stack appear on console log  ",Bug,Critical,Closed,"2018-03-27 00:05:28","2018-03-26 23:05:28",1
"Mule APIkit","jackson-databind is vulnerable to Remote Code Execution (RCE)","h3. Vulnerability Information  Issue  [CVE-2017-7525|http://web.nvd.nist.gov/view/vuln/detail?vulnId=CVE-2017-7525]  Source  National Vulnerability Database  Severity  Sonatype CVSS 3.0: 8.1  Weakness  Sonatype CWE: [502|https://cwe.mitre.org/data/definitions/502.html]  Description from CVE  Reserved CVE.  Explanation  {{jackson-databind}} is vulnerable to Remote Code Execution (RCE). The {{createBeanDeserializer()}} function in the {{BeanDeserializerFactory}} class allows untrusted Java objects to be deserialized. A remote attacker can exploit this by uploading a malicious serialized object that will result in RCE if the application attempts to deserialize it.  Detection  The application is vulnerable by using this component, when default typing is enabled.    Note: Spring Security has provided their own fix for this vulnerability ([CVE-2017-4995|https://pivotal.io/security/cve-2017-4995]). If this component is being used as part of Spring Security, then you are not vulnerable if you are running Spring Security 4.2.3.RELEASE or greater for 4.x or Spring Security 5.0.0.M2 or greater for 5.x.  Recommendation  There is no non vulnerable version of this component. Despite there being a fix provided by Jackson, it uses a black-list approach. If there is another class not black-listed which performs deserialization on the classpath, then this may lead to code execution. We recommend investigating alternative components or a potential mitigating control.    Workaround: Do not use the default typing. Instead you will need to implement your own.  {quote}It is also possible to customize global defaulting, using ObjectMapper.setDefaultTyping(…) – you just have to implement your own TypeResolverBuilder (which is not very difficult); and by doing so, can actually configure all aspects of type information. Builder itself is just a short-cut for building actual handlers.  {quote}  Reference: [https://github.com/FasterXML/jackson-docs/wiki/JacksonPolymorphicDeserialization]    Examples of implementing your own typing can be found by looking at [Spring Security's fix|https://github.com/spring-projects/spring-security/commit/947d11f433b78294942cb5ea56e8aa5c3a0ca439] or [this Stack Overflow article|https://stackoverflow.com/questions/12353774/how-to-customize-jackson-type-information-mechanism].  Categories  Data  Root Cause  ehcache-2.10.4.jar *<=* BeanDeserializerFactory.class_terracotta : [2.0.0-RC1, 2.6.7.1)  Advisories  Third Party: [https://bugzilla.redhat.com/show_bug.cgi?id=CVE-2017-7525]  Project: [https://github.com/FasterXML/jackson-databind/issues/1599]  [Close|https://nexusiq.build.msap.io/rest/report/Soapkit/b3439ac81ec4493a93de25b91a1cdcc5/browseReport/index.html]       Please check this page :    https://wiki.corp.mulesoft.com/pages/viewpage.action?pageId=50824471",Bug,Major,Closed,"2018-01-18 11:42:51","2018-01-18 11:42:51",1
"Mule APIkit","improve soapkit config UI.","Currently soapkit config UI is displaying 3 text boxes one for each soapkit config attribute. Those field should be combos and be populated with the specified wsdl data.",Bug,Critical,Closed,"2015-11-30 01:43:23","2015-11-30 01:43:23",5
"Mule APIkit","SE-10296 Soap router not validating headers","SE-10296  Soap router not validating headers    See related issue for details :)",Bug,"To be reviewed",Closed,"2018-12-14 13:49:48","2018-12-14 13:49:48",2
"Mule APIkit","Support customization for xml empty tags","In SoapKit for Mule 3.x we suggested create a custom user interceptor that was called just before writing the response an at this point we customize XMLOutputWriter. There was a S1 SE issue. Very tricky. We have to support this king of custom interceptors using cxf.xml or provide a high level way to do that.",Bug,Major,Open,"2018-04-12 19:51:37","2018-04-12 18:51:37",5
"Mule APIkit","Inlude WSDL and xsd resources in mule-artifact.json","Mule classloader couldn't find resources if they are not included in mule-artifact.json    e.g.:    ",Bug,"To be reviewed",Closed,"2018-06-13 22:33:00","2018-06-13 21:33:00",2
"Mule APIkit","Upgrade WSDLParser version in SOAPKIT for M4","If we upgrade WSDL Parser to 1.1.4 our test related with metadata fail.    WSDL Parser uses mule.metadata.version 1.1.2.       ",Bug,"To be reviewed",Closed,"2018-07-05 15:19:51","2018-07-05 14:19:51",2
"Mule APIkit","[Plugin] new project from wsdl with imports fails when the path to the wsdl contains spaces","When creating a new Soapkit project from a WSDL with imports, if the path to the wsdl contains at least one Blank Space the creation of the projecet will not work. Stack Trace: ",Bug,Major,Closed,"2015-12-14 23:38:37","2015-12-14 23:38:37",2
"Mule APIkit","SE-7859: Error in the SOAP fault should be included in CDATA","SE-7859: Error in the SOAP fault should be included in CDATA",Bug,Major,Closed,"2018-03-14 15:31:31","2018-03-14 15:31:31",2
"Mule APIkit","SE-11438 APIKit for SOAP fails with operation that has no output","SE-11438 APIKit for SOAP fails with operation that has no output",Bug,"To be reviewed",Resolved,"2019-04-05 15:45:03","2019-04-05 14:45:03",5
"Mule APIkit","Variables created in the operational flow are not available once the flow execution completes and invocation return back to the main flow","Variables created in the operational flow of SOAP kit router are not available once the flow execution completes and invocation return back to the main flow where SOAP Kit Router exists.",Bug,"To be reviewed",Resolved,"2019-08-29 19:41:13","2019-08-29 18:41:13",0
"Mule APIkit","Create RCPTT tests for ODATA 2.0 with Studio 7","Create a mind map with ODATA functional flows.         Use RCPTT to test an ODATA file with and without MAVEN     ",Task,Major,Done,"2018-10-24 19:56:43","2018-10-24 18:56:43",5
"Mule APIkit","Instantiate context statically","In OData Extension for Mule 3, the context (entities and raml model) was initialized during the first call, but that logic was executed for each request without doing anything, becoming confusing code.    Change this behavior to instantiate the context statically",Task,Major,Done,"2018-06-05 13:36:02","2018-06-05 12:36:02",2
"Mule APIkit","Merge latest work with M4-1.2.x","Need to merge in order to be ready to deliver an early access to the feature",Task,"To be reviewed",Done,"2018-10-23 19:04:05","2018-10-23 18:04:05",2
"Mule APIkit","Spike: OData initial design","OData initial design / spec    Is it an APIkit plugin ?",Task,Major,Done,"2018-05-09 19:58:23","2018-05-09 18:58:23",3
"Mule APIkit","Only create Odata Metada for RAML types with odata.remote annotation","While reviewing the test we found that any type declaration was being parsed as odata types this is too restrictive, so now only types with odata.remote annotation will be parsing so the user will be allow to add other types.  ",Task,"To be reviewed",Done,"2018-07-27 15:53:49","2018-07-27 14:53:49",1
"Mule APIkit","Persist attributes before process the flow","We need to persist the attributes before we process the flow since they can be blank (e.g: by a dbconnector) and we need to access them to check the inlinecount attr after processing the flow",Task,"To be reviewed",Done,"2019-01-24 14:34:09","2019-01-24 14:34:09",2
"Mule APIkit","OData support to Juan Brasca","OData support to <USER>",Task,Major,Done,"2018-07-04 16:07:35","2018-07-04 15:07:35",3
"Mule APIkit","Implement  isExtensionEnabled at Apikit","Currently the method isExtensionEnabled() is using a system property, and it should either look for an atrribute at the apikit xml tag or set a boolean at init if the extension is at the classpath.",Task,"To be reviewed",Done,"2018-07-20 21:41:04","2018-07-20 20:41:04",2
"Mule APIkit","Spec on APIKit for ODATA V4 - Phase 1","*Spec on APIKit for ODATA V4*    the goal of this task is to create a document that describes all the behaviour of APIKit for ODATA covering ODATA v4 for a first round of review.    this includes:  -> Project structure  -> Module structure (configs, operations, sources, parameters)  -> Module execution  -> Metadata  -> ODATA use cases  -> Gaps and required features  -> min mule version  -> impact on other teams  -> impact on other familiy products (scaffolder, UI, Metadata)   ",Task,"To be reviewed",Done,"2019-07-18 18:18:30","2019-07-18 17:18:30",13
"Mule APIkit","Release OData 2.0.0 RC-1","Release OData RC-1",Task,"To be reviewed",Done,"2018-12-05 18:41:40","2018-12-05 18:41:40",1
"Mule APIkit","Add code formatter","Need to add code formatter",Task,"To be reviewed",Done,"2019-05-17 21:39:23","2019-05-17 20:39:23",2
"Mule APIkit","Tooling: generate Amplitude events","Code OData 2.0.0 Studio tooling    OData Plugin: generate events so that it gets tracked in Amplitude. More info [here|https://docs.google.com/document/d/1x3L4acL2zkj7QD0IvQcvHdNXkaBIOaVo6J78bfnXosU/edit?usp=sharing].              Meet with Diego M. and <USER>   In previous versions, we used Bamboo to deploy the plugin.    How to deploy using Cloudbees?    How to sign the plugin extension?",Task,Major,Done,"2018-06-22 16:31:11","2018-06-22 15:31:11",5
"Mule APIkit","Update Odata Extension version to 2.0.0","Update Odata Extension version to 2.0.0",Task,"To be reviewed",Done,"2018-07-12 22:25:45","2018-07-12 21:25:45",1
"Mule APIkit","Release OData Studio Plugin for version 1.0.8","Release OData Studio Plugin for version 1.0.8",Task,"To be reviewed",Done,"2018-12-22 01:13:06","2018-12-22 01:13:06",1
"Mule APIkit","Spike:  OData initial design","Spike: OData initial design",Task,Major,Done,"2018-05-09 20:24:58","2018-05-09 19:24:58",5
"Mule APIkit","Error when running all tests on apikit-odata-service-test ","When running all tests on apikit-odata-service-test some test throws errors but when running the test for that single class they run ok.",Task,"To be reviewed",Done,"2019-02-13 12:52:42","2019-02-13 12:52:42",2
"Mule APIkit","Deploy OData tooling for studio 6.x","Deploy OData tooling for studio 6.x",Task,"To be reviewed",Done,"2019-06-19 20:46:08","2019-06-19 19:46:08",2
"Mule APIkit","Add MTF tests to OData MySQL example","Add MTF tests to OData MySQL example at documentation [https://docs.mulesoft.com/apikit/4.x/creating-an-odata-api-with-apikit]",Task,"To be reviewed",Done,"2019-06-05 20:46:20","2019-06-05 19:46:20",8
"Mule APIkit","Create Tests using MTF","Create new suite of tests using MTF",Task,"To be reviewed",Done,"2018-06-26 17:14:59","2018-06-26 16:14:59",8
"Mule APIkit","Create update site for OData 2.0.0","Release OData tooling (create update site for OData 1.2.0)",Task,"To be reviewed",Done,"2018-11-21 19:03:30","2018-11-21 19:03:30",1
"Mule APIkit","Migrate tests on apikit-odata-service-test repository for mule 4 version","Migrate tests on apikit-odata-service-test repository for mule 4 version",Task,Major,Done,"2019-02-04 14:26:04","2019-02-04 14:26:04",2
